{
  "id": "invias",
  "name": "INVIAS",
  "description": "Instituto Nacional de Vías: HERMES (SIV), datos abiertos viales y mapa de vulnerabilidad faunística. DB2S-GEO solo documenta acceso.",
  "url": "https://www.invias.gov.co",
  "category": "instituto",
  "coverage": {
    "spatial": "Colombia",
    "temporal": "Según publicación de la fuente"
  },
  "status": "active",
  "institution": "Instituto Nacional de Vías (INVIAS)",
  "domains": [
    "biodiversidad",
    "infraestructura",
    "observacion_tierra"
  ],
  "license": "Según términos INVIAS / HERMES",
  "version": "1.1.0",
  "resources": [
    {
      "id": "invias:hermes",
      "name": "HERMES — Sistema de Información Vial (INVIAS)",
      "description": "Sistema de Información Vial HERMES (SIV) del INVIAS: consulta de red vial nacional (concesionada y no concesionada), puentes, peajes y planificación de rutas. Incluye visor HERMES2 y servicios ArcGIS REST (mapa de carreteras / SIV). DB2S-GEO solo documenta el acceso; no descarga geometrías.",
      "url": "https://hermes2.invias.gov.co/SIV/",
      "category": "catalog",
      "coverage": {
        "spatial": "Colombia (red vial a cargo / publicada)",
        "temporal": "Según actualizaciones HERMES / capas publicadas"
      },
      "domains": [
        "infraestructura"
      ],
      "keywords": [
        "acueducto",
        "aeropuerto",
        "carretera",
        "carreteras",
        "conectividad",
        "conexion",
        "hermes",
        "infraestructura",
        "invias",
        "peajes",
        "puentes",
        "puerto",
        "red",
        "seguro",
        "siv",
        "territorial",
        "transporte",
        "via",
        "viaje",
        "vial"
      ],
      "access_methods": [
        "portal",
        "arcgis"
      ],
      "endpoints": [
        {
          "method": "portal",
          "url": "https://hermes2.invias.gov.co/SIV/",
          "label": "HERMES2 — Sistema de Información Vial"
        },
        {
          "method": "arcgis",
          "url": "https://hermes.invias.gov.co/arcgis/rest/services/Mapa_Carreteras/Mapa_de_Carreteras/MapServer",
          "label": "MapServer Mapa de Carreteras INVIAS"
        },
        {
          "method": "arcgis",
          "url": "https://hermes.invias.gov.co/arcgis/rest/services/Sistema_informacion_vial/SIV_V20/MapServer",
          "label": "MapServer SIV V20 HERMES"
        }
      ],
      "formats": [
        "visor web",
        "MapServer",
        "portal"
      ],
      "documentation_url": "https://hermes2.invias.gov.co/",
      "doi": "",
      "citation_reference": "Instituto Nacional de Vías (INVIAS). HERMES — Sistema de Información Vial. https://hermes2.invias.gov.co/SIV/"
    },
    {
      "id": "invias:vulnerabilidad-faunistica",
      "name": "Mapa de vulnerabilidad faunística al atropellamiento (INVIAS)",
      "description": "Mapa nacional de vulnerabilidad faunística y riesgo de atropellamiento de fauna silvestre en vías primarias a cargo del INVIAS (ITM / Política de Sostenibilidad). Apoya pasos de fauna y mitigación en proyectos viales. Visor en HERMES. DB2S-GEO solo documenta el acceso; no descarga capas.",
      "url": "https://www.invias.gov.co",
      "category": "dataset",
      "coverage": {
        "spatial": "Colombia (red vial primaria INVIAS)",
        "temporal": "Según versión del mapa publicada por INVIAS"
      },
      "domains": [
        "biodiversidad",
        "observacion_tierra"
      ],
      "keywords": [
        "acueducto",
        "aeropuerto",
        "amenaza",
        "area_protegida",
        "atropellamiento",
        "biodiversidad",
        "bioma",
        "carretera",
        "conectividad",
        "conexion",
        "conservacion",
        "corredores",
        "desastre",
        "deslizamiento",
        "diversidad",
        "ecologica",
        "ecologicos",
        "ecosistema",
        "ecosistemas",
        "emergencia",
        "especie",
        "especies",
        "fauna",
        "faunistica",
        "flora",
        "habitat",
        "incendio",
        "infraestructura",
        "inundacion",
        "invias",
        "peligro",
        "protegida",
        "puerto",
        "red",
        "resiliencia",
        "riesgo",
        "sukubun",
        "transporte",
        "via",
        "vial",
        "vulnerabilidad"
      ],
      "access_methods": [
        "portal"
      ],
      "endpoints": [
        {
          "method": "portal",
          "url": "https://www.invias.gov.co",
          "label": "INVIAS - Vulnerabilidad Faunistica"
        }
      ],
      "formats": [
        "visor web",
        "mapa",
        "portal"
      ],
      "documentation_url": "https://mintransporte.gov.co/publicaciones/10864/gobierno-nacional-lanza-mapa-para-identificar-puntos-de-mayor-vulnerabilidad-faunistica-al-atropellamiento-en-proyectos-viales/",
      "doi": "",
      "citation_reference": "Instituto Nacional de Vías (INVIAS) / ITM. Mapa de vulnerabilidad faunística al atropellamiento en vías. https://hermes.invias.gov.co/VulnerabilidadFaunistica/"
    },
    {
      "id": "invias:datos-abiertos-viales",
      "name": "Datos abiertos de infraestructura vial (INVIAS)",
      "description": "Conjuntos de datos abiertos oficiales del INVIAS sobre infraestructura vial: red vial, puentes, pontones, peajes y postes de referencia. Disponibles vía Open Data ArcGIS INVIAS, FeatureServer OpenData/HERMES y datos.gov.co. DB2S-GEO solo documenta el acceso; no descarga tablas.",
      "url": "https://inviasopendata-invias.opendata.arcgis.com/",
      "category": "dataset",
      "coverage": {
        "spatial": "Colombia",
        "temporal": "Según publicación de cada conjunto abierto"
      },
      "domains": [
        "observacion_tierra"
      ],
      "keywords": [
        "abiertos",
        "acueducto",
        "aeropuerto",
        "carretera",
        "conexion",
        "infraestructura",
        "invias",
        "opendata",
        "peajes",
        "postes",
        "puentes",
        "puerto",
        "red",
        "referencia",
        "transporte",
        "via",
        "vial",
        "vias"
      ],
      "access_methods": [
        "portal",
        "arcgis"
      ],
      "endpoints": [
        {
          "method": "portal",
          "url": "https://inviasopendata-invias.opendata.arcgis.com/",
          "label": "Portal Open Data ArcGIS INVIAS"
        },
        {
          "method": "arcgis",
          "url": "https://hermes.invias.gov.co/arcgis/rest/services/OpenData/ServiciosOpenData/FeatureServer",
          "label": "FeatureServer OpenData — red, peajes, puentes"
        },
        {
          "method": "portal",
          "url": "https://www.datos.gov.co/Transporte/Tr-fico-Peajes-Invias/tcfu-jngt",
          "label": "Datos.gov.co — Tráfico Peajes INVIAS"
        }
      ],
      "formats": [
        "FeatureServer",
        "CSV/tablas",
        "portal Open Data"
      ],
      "documentation_url": "https://www.invias.gov.co/publicaciones/6264/sistema-de-informacion-vial/",
      "doi": "",
      "citation_reference": "Instituto Nacional de Vías (INVIAS). Datos abiertos de infraestructura vial. https://inviasopendata-invias.opendata.arcgis.com/"
    },
    {
      "id": "invias:arcgis-rest",
      "name": "Servicios ArcGIS REST — INVIAS",
      "description": "Servicios ArcGIS REST verificados por el curador de DB2S-GEO el 2026-10-03: INVIAS — red vial nacional. Capas consumibles en ArcGIS Pro y QGIS. DB2S-GEO solo documenta el acceso; no descarga capas.",
      "url": "https://hermes.invias.gov.co/arcgis/rest/services",
      "category": "geoservice",
      "coverage": {
        "spatial": "Colombia",
        "temporal": "Según publicación de la fuente"
      },
      "domains": [
        "infraestructura",
        "biodiversidad",
        "observacion_tierra"
      ],
      "keywords": [
        "vias",
        "carreteras",
        "opendata",
        "transporte",
        "arcgis",
        "rest",
        "geoservicio",
        "servicios"
      ],
      "access_methods": [
        "arcgis"
      ],
      "endpoints": [
        {
          "method": "arcgis",
          "url": "https://hermes.invias.gov.co/arcgis/rest/services",
          "label": "Directorio ArcGIS REST INVIAS"
        },
        {
          "method": "arcgis",
          "url": "https://hermes.invias.gov.co/arcgis/rest/services/OpenData/ServiciosOpenData/MapServer",
          "label": "Datos abiertos INVIAS"
        },
        {
          "method": "arcgis",
          "url": "https://hermes.invias.gov.co/arcgis/rest/services/OpenData/ServiciosOpenData/FeatureServer",
          "label": "Datos abiertos INVIAS (features)"
        },
        {
          "method": "arcgis",
          "url": "https://hermes2.invias.gov.co/server/rest/services/N_767/Consulta767/MapServer",
          "label": "Consulta 767 (Hermes)"
        }
      ],
      "formats": [
        "servicios REST",
        "MapServer",
        "FeatureServer"
      ],
      "documentation_url": "https://hermes.invias.gov.co/arcgis/rest/services",
      "doi": "",
      "citation_reference": "Instituto Nacional de Vías (INVIAS). Servicios ArcGIS REST — INVIAS. https://hermes.invias.gov.co/arcgis/rest/services"
    }
  ]
}
